{
  "schema_version": 1,
  "id": "evt_2025_ai_resume_generator",
  "title": "AI Resume Generator",
  "type": "project",
  "custom_type": null,
  "time": {
    "start": "2025-05",
    "end": "2025-08",
    "precision": "month"
  },
  "status": "confirmed",
  "description": "Built a template-driven resume generation workflow and explored AI-assisted rewriting for target job descriptions.",
  "role": "Creator",
  "organization": null,
  "location": "Remote",
  "tags": ["AI", "resume", "LaTeX"],
  "details": {
    "tech_stack": "Python, LaTeX",
    "achievement": "Designed a reusable resume generation pipeline."
  },
  "claims": [
    "Designed a template-driven resume generation workflow.",
    "Explored AI-assisted resume customization for target job descriptions."
  ],
  "sources": ["sources/src_sample_resume.md"],
  "relations": [],
  "visibility": "private",
  "created_at": "2026-06-25T00:00:00+00:00",
  "updated_at": "2026-06-25T00:00:00+00:00"
}
